{
  "$schema": "https://json-schema.org/draft/2020-12/schema",
  "$id": "https://project-relay.dev/project/status.schema.json",
  "title": "Project Relay Status",
  "type": "object",
  "additionalProperties": false,
  "required": ["schema_version", "project", "updated_at", "milestones", "pilots"],
  "properties": {
    "schema_version": { "const": "0.1.0" },
    "project": {
      "type": "object",
      "additionalProperties": false,
      "required": ["id", "name", "stage", "repository"],
      "properties": {
        "id": { "type": "string", "pattern": "^[a-z][a-z0-9-]{2,63}$" },
        "name": { "type": "string", "minLength": 3, "maxLength": 100 },
        "stage": { "enum": ["pre-alpha", "alpha", "beta", "stable"] },
        "repository": { "type": "string", "format": "uri" }
      }
    },
    "updated_at": { "type": "string", "format": "date" },
    "milestones": {
      "type": "array",
      "minItems": 1,
      "items": { "$ref": "#/$defs/milestone" }
    },
    "pilots": {
      "type": "array",
      "items": { "$ref": "#/$defs/pilot" }
    }
  },
  "$defs": {
    "evidence_link": {
      "type": "object",
      "additionalProperties": false,
      "required": ["label", "uri"],
      "properties": {
        "label": { "type": "string", "minLength": 1, "maxLength": 160 },
        "uri": { "type": "string", "minLength": 1, "maxLength": 2000 }
      }
    },
    "blocker": {
      "type": "object",
      "additionalProperties": false,
      "required": ["kind", "summary"],
      "properties": {
        "kind": { "enum": ["external", "human-action", "dependency", "decision"] },
        "summary": { "type": "string", "minLength": 5, "maxLength": 1000 }
      }
    },
    "work_item": {
      "type": "object",
      "additionalProperties": false,
      "required": ["id", "title", "state", "evidence"],
      "properties": {
        "id": { "type": "string", "pattern": "^[A-Z][A-Z0-9-]{2,63}$" },
        "title": { "type": "string", "minLength": 3, "maxLength": 200 },
        "state": { "enum": ["done", "in_progress", "blocked", "planned", "deferred"] },
        "evidence": {
          "type": "array",
          "items": { "$ref": "#/$defs/evidence_link" }
        },
        "blocker": { "$ref": "#/$defs/blocker" },
        "rationale": { "type": "string", "minLength": 5, "maxLength": 2000 },
        "next_action": { "type": "string", "minLength": 5, "maxLength": 1000 }
      }
    },
    "milestone": {
      "type": "object",
      "additionalProperties": false,
      "required": ["id", "title", "exit_criteria", "items"],
      "properties": {
        "id": { "type": "string", "pattern": "^M[0-9]+$" },
        "title": { "type": "string", "minLength": 3, "maxLength": 160 },
        "exit_criteria": {
          "type": "array",
          "minItems": 1,
          "items": { "type": "string", "minLength": 5, "maxLength": 1000 }
        },
        "items": {
          "type": "array",
          "minItems": 1,
          "items": { "$ref": "#/$defs/work_item" }
        }
      }
    },
    "pilot": {
      "type": "object",
      "additionalProperties": false,
      "required": ["id", "name", "visibility", "boundary", "items"],
      "properties": {
        "id": { "type": "string", "pattern": "^[a-z][a-z0-9-]{2,63}$" },
        "name": { "type": "string", "minLength": 2, "maxLength": 100 },
        "visibility": { "const": "operational-summary-only" },
        "boundary": { "type": "string", "minLength": 20, "maxLength": 2000 },
        "items": {
          "type": "array",
          "minItems": 1,
          "items": { "$ref": "#/$defs/work_item" }
        }
      }
    }
  }
}
